Home Remedy for,Dose & Duration
IBS /Digestive boost,"Consume 1 teaspoon 3 times a day, after meal."
Metabolic boost,"Consume 1 teaspoon twice a day, ideally after lunch and dinner."
Nervine-S1 (If vata pitta),Consume once a day at bedtime
Nervine-S2 (if vata- kapha) ,Consume once a day at bedtime
Nervine-S3 ( if pitta- kapha) ,Consume once a day 45 mins before dinner/ at bedtime 
Immunity boost-C2 (if vata-kapha),Consume 1/2 cup twice a day
"Immunity boost-C4 (if vata- pitta, kapha-pitta)",Consume 1/2 cup twice a day
Alkaline boost,"Dose- 1 tbsp twice a day, before food/ empty stomach-"